{
    "isaac_record_version": "1.0",
    "record_id": "01JFH9INTENT00000000000001",
    "record_type": "intent",
    "record_domain": "characterization",
    "timestamps": {
        "created_utc": "2026-06-01T08:00:00Z"
    },
    "acquisition_source": {
        "source_type": "computation",
        "computation": {
            "agent_id": "isaac_campaign_manager_v2",
            "campaign_id": "discovery_campaign_cu_variants"
        }
    },
    "sample": {
        "material": {
            "name": "Target: Low-index Copper facets",
            "formula": "Cu",
            "provenance": "request",
            "notes": "Requesting spectral data for ANY pure copper surface (111, 100, or 110)."
        },
        "sample_form": "any"
    },
    "context": {
        "environment": "in_situ",
        "temperature_K": 300,
        "notes": "Must be performed at room temperature under vacuum or He."
    },
    "system": {
        "domain": "experimental",
        "configuration": {
            "notes": "Requesting a beamline capability, not a specific instrument."
        }
    },
    "measurement": {
        "qc": {
            "status": "pending"
        },
        "series": [
            {
                "series_id": "required_measurements",
                "independent_variables": [
                    {
                        "name": "energy",
                        "unit": "eV",
                        "values": [
                            8900,
                            9100
                        ],
                        "notes": "Must cover Cu K-edge (8979 eV) with at least 50 eV post-edge."
                    }
                ],
                "channels": [
                    {
                        "name": "absorption",
                        "unit": "any",
                        "role": "primary_signal"
                    }
                ]
            }
        ]
    }
}